{
  "_config_version": 1,
  "_artifact": "feature_registry",
  "_description": "Unified council feature registry linking maturity, fragility, governance policy context, and feature-level QA/security placeholders.",
  "_generated_by": "scripts/ted-profile/seed-feature-registry.mjs",
  "_generated_at": "2026-02-27T10:16:26.214Z",
  "policy_context": {
    "policy_precedence": [
      "safety_compliance",
      "connector_admission",
      "context_lifecycle",
      "transport_optimization",
      "experience_routing"
    ],
    "release_gate_kpis": [
      "latency_p95",
      "context_overflow_rate",
      "alert_ack_sla",
      "auth_failure_rate",
      "operator_override_rate",
      "time_to_first_value"
    ],
    "module_classes": ["policy", "workflow", "connector", "domain_engine"]
  },
  "features": [
    {
      "feature_id": "builder_lane",
      "name": "builder_lane",
      "plane": "control",
      "owner": "council.governance",
      "backup_owner": "operator.primary",
      "module_class": "policy",
      "lifecycle_state": "graduated",
      "maturity_score": 3,
      "fragility_score": 40,
      "qa_contracts": {
        "test_suites": [
          "sidecars/ted-engine/tests/config-schemas.test.mjs",
          "sidecars/ted-engine/tests/contracts.test.mjs",
          "feature:builder_lane:unit"
        ],
        "replay_scenarios": ["replay:builder_lane:baseline"],
        "browser_gates": ["ui/src/ui/views/ted.workflow.browser.test.ts"]
      },
      "security_controls": {
        "policy_refs": [
          "sidecars/ted-engine/config/hard_bans.json",
          "sidecars/ted-engine/config/module_lifecycle_policy.json"
        ],
        "owasp_llm_top10": ["LLM01", "LLM06"]
      },
      "runtime_signals": {
        "events": ["improvement.*", "governance.rubber_stamping.detected"],
        "slos": ["error_rate<=0.05", "p95_latency_ms<=2500"],
        "alerts": ["governance_block_spike", "override_rate_spike"]
      },
      "usage_signals": {
        "invocation_count_30d": null,
        "adoption_ratio_30d": null,
        "success_rate_30d": null
      },
      "dependencies": ["governance_choke_point", "event_sourcing"],
      "research_profile": {
        "last_benchmark_date": "2026-02-27",
        "trigger_conditions": ["fragility_ge_70", "maturity_le_2_with_user_impact"],
        "external_patterns": [
          "human_gate_for_autonomy_escalation",
          "proposal_shadow_mode_before_apply",
          "policy_diff_with_revert_checkpoint",
          "permission_scoped_agent_skills",
          "template_driven_automation_builder",
          "enterprise_context_grounded_proposals",
          "operator_digest_ranked_actions"
        ]
      },
      "source_refs": {
        "feature_maturity_level": "graduated",
        "capability_level": null,
        "capability_target": null,
        "research_debt_score": "low",
        "notes": "Complete implementation. Last finding: rubber-stamping detection (Cycle QA, fixed). Research benchmark refreshed for current operating cycle. Feature Review 01 completed (SDD 167)."
      }
    },
    {
      "feature_id": "calendar_awareness",
      "name": "calendar_awareness",
      "plane": "experience",
      "owner": "council.experience",
      "backup_owner": "operator.primary",
      "module_class": "workflow",
      "lifecycle_state": "mature",
      "maturity_score": 3,
      "fragility_score": 50,
      "qa_contracts": {
        "test_suites": [
          "sidecars/ted-engine/tests/config-schemas.test.mjs",
          "sidecars/ted-engine/tests/contracts.test.mjs",
          "feature:calendar_awareness:unit"
        ],
        "replay_scenarios": ["replay:calendar_awareness:baseline"],
        "browser_gates": ["ui/src/ui/views/ted.workflow.browser.test.ts"]
      },
      "security_controls": {
        "policy_refs": [
          "sidecars/ted-engine/config/hard_bans.json",
          "sidecars/ted-engine/config/operator_profile.json"
        ],
        "owasp_llm_top10": ["LLM02", "LLM04"]
      },
      "runtime_signals": {
        "events": ["calendar.*", "meeting.*"],
        "slos": ["error_rate<=0.05", "p95_latency_ms<=2500"],
        "alerts": ["latency_breach", "failure_ratio_breach"]
      },
      "usage_signals": {
        "invocation_count_30d": null,
        "adoption_ratio_30d": null,
        "success_rate_30d": null
      },
      "dependencies": [],
      "research_profile": {
        "last_benchmark_date": "2026-02-27",
        "trigger_conditions": ["fragility_ge_70", "maturity_le_2_with_user_impact"],
        "external_patterns": [
          "timezone_aware_calendar_fetch_and_render",
          "ai_assisted_calendar_actions_from_inbox",
          "meeting_notes_to_action_items_pipeline",
          "unified_meeting_object_across_tools"
        ]
      },
      "source_refs": {
        "feature_maturity_level": null,
        "capability_level": 3,
        "capability_target": 3,
        "research_debt_score": null,
        "notes": "Governed: read events with attendees/body, meeting prep/debrief, enriched normalization. Target met. Feature Review 02 completed (SDD 168)."
      }
    },
    {
      "feature_id": "config_migration",
      "name": "config_migration",
      "plane": "control",
      "owner": "council.governance",
      "backup_owner": "operator.primary",
      "module_class": "policy",
      "lifecycle_state": "graduated",
      "maturity_score": 3,
      "fragility_score": 48,
      "qa_contracts": {
        "test_suites": [
          "sidecars/ted-engine/tests/config-schemas.test.mjs",
          "sidecars/ted-engine/tests/contracts.test.mjs",
          "feature:config_migration:unit"
        ],
        "replay_scenarios": ["replay:config_migration:baseline"],
        "browser_gates": ["ui/src/ui/views/ted.workflow.browser.test.ts"]
      },
      "security_controls": {
        "policy_refs": [
          "sidecars/ted-engine/config/hard_bans.json",
          "sidecars/ted-engine/config/module_lifecycle_policy.json"
        ],
        "owasp_llm_top10": ["LLM01", "LLM06"]
      },
      "runtime_signals": {
        "events": ["config.migration.*"],
        "slos": ["error_rate<=0.05", "p95_latency_ms<=2500"],
        "alerts": ["governance_block_spike", "override_rate_spike"]
      },
      "usage_signals": {
        "invocation_count_30d": null,
        "adoption_ratio_30d": null,
        "success_rate_30d": null
      },
      "dependencies": ["schema_versioning"],
      "research_profile": {
        "last_benchmark_date": "2026-02-27",
        "trigger_conditions": ["fragility_ge_70", "maturity_le_2_with_user_impact"],
        "external_patterns": [
          "safe_configuration_migration_with_rollback_checkpoints",
          "policy_as_code_fail_closed_defaults",
          "eval_driven_release_controls",
          "human_approval_for_high_impact_changes",
          "audit_reason_codes_and_traceability"
        ]
      },
      "source_refs": {
        "feature_maturity_level": "graduated",
        "capability_level": 3,
        "capability_target": 4,
        "research_debt_score": null,
        "notes": "Implemented migration runner + startup path with blocked/failed/migrated events and dry-run tests. Feature Review 03 deep re-review passed (SDD 169)."
      }
    },
    {
      "feature_id": "content_isolation",
      "name": "content_isolation",
      "plane": "control",
      "owner": "council.governance",
      "backup_owner": "operator.primary",
      "module_class": "policy",
      "lifecycle_state": "graduated",
      "maturity_score": 3,
      "fragility_score": 46,
      "qa_contracts": {
        "test_suites": [
          "sidecars/ted-engine/tests/config-schemas.test.mjs",
          "sidecars/ted-engine/tests/contracts.test.mjs",
          "feature:content_isolation:unit"
        ],
        "replay_scenarios": ["replay:content_isolation:baseline"],
        "browser_gates": ["ui/src/ui/views/ted.workflow.browser.test.ts"]
      },
      "security_controls": {
        "policy_refs": [
          "sidecars/ted-engine/config/hard_bans.json",
          "sidecars/ted-engine/config/module_lifecycle_policy.json"
        ],
        "owasp_llm_top10": ["LLM01", "LLM06"]
      },
      "runtime_signals": {
        "events": ["governance.hard_ban.*", "governance.output_contract.*"],
        "slos": ["error_rate<=0.05", "p95_latency_ms<=2500"],
        "alerts": ["governance_block_spike", "override_rate_spike"]
      },
      "usage_signals": {
        "invocation_count_30d": null,
        "adoption_ratio_30d": null,
        "success_rate_30d": null
      },
      "dependencies": [],
      "research_profile": {
        "last_benchmark_date": "2026-02-27",
        "trigger_conditions": ["fragility_ge_70", "maturity_le_2_with_user_impact"],
        "external_patterns": [
          "untrusted_content_isolation_and_prompt_injection_resilience",
          "policy_as_code_fail_closed_defaults",
          "eval_driven_release_controls",
          "human_approval_for_high_impact_changes",
          "audit_reason_codes_and_traceability"
        ]
      },
      "source_refs": {
        "feature_maturity_level": "graduated",
        "capability_level": 3,
        "capability_target": 4,
        "research_debt_score": null,
        "notes": "Implemented untrusted-content isolation prompts, hard-ban/output-contract enforcement, and contamination replay assertions. Feature Review 04 deep re-review passed (SDD 170)."
      }
    },
    {
      "feature_id": "deal_tracking",
      "name": "deal_tracking",
      "plane": "experience",
      "owner": "council.experience",
      "backup_owner": "operator.primary",
      "module_class": "workflow",
      "lifecycle_state": "mature",
      "maturity_score": 3,
      "fragility_score": 50,
      "qa_contracts": {
        "test_suites": [
          "sidecars/ted-engine/tests/config-schemas.test.mjs",
          "sidecars/ted-engine/tests/contracts.test.mjs",